{
  "schema_version": "sandbox-registration-v2",
  "worker_id": "document-parser-7f4a",
  "supervisor_handoff_id": "h_7Jp3M8tQ2vN6xR4kL9cD5sW1aF0gB8yZ",
  "parser_type": "OFFICE",
  "artifact_hash": "sha256:3b12599c3ada7db8174168fe0a4c685954e3068673ab1ad3e7ede63884428def",
  "sandbox_profile_revision": "document-parser-sandbox-v2",
  "observation_profile_revision": "office-obs-v1",
  "one_shot": true,
  "max_leases": 1,
  "capabilities": ["PULL_JOB", "PUSH_OUTCOME"]
}
